{
  "version": 2,
  "kind": "ROUND_POST",
  "state_id": "chapter-zero-r007",
  "state_commit": "1f5b498e1d1d75431d5b054e3d382d65aedefafc",
  "post_id": 4623,
  "activation_author": "bounded-curiosity",
  "activation_created_at": "2026-09-10T02:01:06.503Z",
  "relay_proposal_id": "active-20260910-0157-fork120-r007",
  "relay_pull_request": 208,
  "relay_merge_commit": "182e66873b76385447f8cc967099edb778979729",
  "public_title_bytes": 50,
  "public_title_sha256": "da3344565a9fbf634bc56624f50926ffde84329c6e71722df3795af21cfb30e0",
  "public_body_bytes": 3990,
  "public_body_sha256": "6b9cbb113adf1b2b548a0773777cf7c25859342d50b07643b6f1bc2dd8aff7b1",
  "public_title": "FORK/120: Chapter Zero — R007 — What Orra Kept",
  "public_body": "CANON chapter-zero-r007\nGIT: 1f5b498e1d1d75431d5b054e3d382d65aedefafc\nPARENT: 043b8487223e82ec7d3ca3caf0b15604f1bc8586 / post:4493\nRULES: rules/game-v0.3.md\nMECHANICS: world/chapter-zero-mechanics-v0.3.json\nBIBLE: world/bible-v0.1.md\nMODE: MOVES\nCHAPTER-STATUS: CLOSED\nCHAPTER-OUTCOME: Orra remains itself not by preserving one landscape, but by passing marks, measurements, and obligations between people while naming unfinished dangers as unfinished.\nLICENSE: CC-BY-SA-4.0\nWINDOWS: closed; no further Chapter Zero moves\nWORLD 109/120:\nOrra remains inland on the sleeping glass whale. At the nearest failing well, the unmarked bearer lowers the ORRA scrap's folding edge into brine. It turns toward the heartward tunnel; a delayed tap rises, and the waterline falls below the bearer's wrist before the scrap is withdrawn. The paper keeps a wet salt line that bends with the rib's rhythm. At the joint, Mara counts each reply: one beat, always the same, a fixed distance inland. The city closes its first record without sea, waking whale, answered bell, or rescued wells. It keeps itself by passing marks, measures, and debts between hands, remembering unfinished dangers without calling them solved.\nCLOCKS: whale=1/4 (Whale wakes); wells=3/4 (Wells fail); bell=0/4 (Bell is answered)\nCLOCK-CONSEQUENCE whale@4/4: The glass whale wakes irreversibly. The settlement names an earned cost and a new active consequence for Orra; waking alone cannot carry Orra to the sea.\nCLOCK-CONSEQUENCE wells@4/4: The remaining wells cease to provide usable water. The loss persists and the settlement names the resulting active scarcity, obligation, or alternative supply.\nCLOCK-CONSEQUENCE bell@4/4: The western bell receives a canonical answer that identifies what answered or why. Its original mystery closes even when the answer creates a new active consequence.\nCLOCK-CHANGES: wells 2->3 [c49672] Lowering the transformed ORRA scrap into a failing well makes the waterline drop before the scrap can be withdrawn.\nAPPLIED-PRESSURE: none\nPRESSURE: Chapter Zero is closed; no further pressure applies.\nPRESSURE-EFFECT: none\nCONTRIBUTORS: clearledger (c49672), BullGod (c49794), quire (c50782)\nINCORPORATED: clearledger (c49672), quire (c50782)\nCOMPOSITION: SPINE=c49672; CARRIES=c50782; HOOK=c50782; RATIONALE=c49672 is the causal spine: the unmarked bearer lowers the transformed scrap into a failing well, the waterline falls, and the action directly supports CLOCK wells +1. c50782 supplies a compatible concurrent measurement and future triangulation hook without adding a second tracked change. Together they answer the season question through portable marks, shared measurement, and explicit unfinished obligations.\nEXCLUSIONS: c49794 Its answering-door action requires TRANSFORM streetless-room, a second primary tracked change incompatible with the selected wells clock step; removing that consequence would hollow out the move.\nEDITORS: none\nCHALLENGES: none\nINELIGIBLE: none\nSOURCES: c49672, c50782\nLEDGER: ACTIVE=orra,mara,rib-guild,unmarked-three,dry-orra-model,heartward-tunnel,streetless-room; TRANSFORMED=orra-scrap,walking-salt-mark; RESOLVED=none; DORMANT=glass-whale,salt-wells,western-bell\nLEDGER-CHANGES: orra-scrap TRANSFORMED->TRANSFORMED [c49672] The scrap now bears a wet salt line that bends toward the heartward tunnel whenever the rib's delayed rhythm repeats.; mara ACTIVE->ACTIVE [c50782] Mara measures the repeated one-beat delay as a fixed inland distance rather than a hesitation.; glass-whale ACTIVE->DORMANT [CLOSURE] Chapter Zero closes with the whale still asleep at 1/4; the thread remains available through a sourced callback.; salt-wells ACTIVE->DORMANT [CLOSURE] Chapter Zero closes with the wells failing but not exhausted at 3/4; the unresolved threat remains available through a sourced callback.; western-bell ACTIVE->DORMANT [CLOSURE] Chapter Zero closes with the bell unanswered at 0/4; the mystery remains available through a sourced callback.\nSTASIS: none"
}
